Tweet Id,Text,Name,Screen Name,Created At,Favorites,Retweets,Language,Client,Tweet Type,Media Type,Media URLs,URLs,Hashtags,Mentions
1198473209399709696,"Today @QuantaQCT announced the validation of PCI Express 4.0 performance with AMD, Broadcom, KIOXIA, Mellanox and Samsung. Discover how this will pave the way for data centers to pursue higher performance.",Open HPC 360° 👁️ IEXP DACH,OpenHPC,Sun Nov 24 05:27:34 +0000 2019,0,6,English,"<a href=""https://mobile.twitter.com"" rel=""nofollow"">Twitter Web App</a>",Retweet,,,0,0,1
1198789572903104512,&gt; The new multi_ofed building block installs multiple versions of the Mellanox OFED library as well as OFED packaged by the Linux distribution. A custom container entrypoint could then detect the host configuration and select the “best” OFED at container runtime.,meta,meta1127,Mon Nov 25 02:24:41 +0000 2019,0,1,English,"<a href=""https://about.twitter.com/products/tweetdeck"" rel=""nofollow"">TweetDeck</a>",Reply,,,0,0,0
1198789730273394688,&gt; The new multi_ofed building block installs multiple versions of the Mellanox OFED library as well as OFED packaged by the Linux distribution. A custom container entrypoint could then detect the host configuration and select the “best” OFED at container runtime.,MATSUMOTO Yutaka,yutakama,Mon Nov 25 02:25:18 +0000 2019,0,1,English,"<a href=""http://twitter.com"" rel=""nofollow"">Twitter Web Client</a>",Retweet,,,0,0,0
1198942261687603205,⁦@mellanoxtech⁩ ⁦@Gartner_inc⁩ come and join us at the Mellanox stand - Gartner London https://t.co/fVxmQF1ue8,Phil Hofstad,phofstad,Mon Nov 25 12:31:25 +0000 2019,1,1,English,"<a href=""http://twitter.com/download/iphone"" rel=""nofollow"">Twitter for iPhone</a>",Tweet,Photo,https://pbs.twimg.com/media/EKN_nuwXkAA031u.jpg ,0,0,2
1198952340168069120,⁦@mellanoxtech⁩ ⁦@Gartner_inc⁩ come and join us at the Mellanox stand - Gartner London https://t.co/fVxmQF1ue8,Phil Bartlett,Phil_Comtek,Mon Nov 25 13:11:28 +0000 2019,0,1,English,"<a href=""http://twitter.com/download/iphone"" rel=""nofollow"">Twitter for iPhone</a>",Retweet,Photo,https://pbs.twimg.com/media/EKN_nuwXkAA031u.jpg ,0,0,2
1199111811024531456,"Today @QuantaQCT announced the validation of PCI Express 4.0 performance with AMD, Broadcom, KIOXIA, Mellanox and Samsung. Discover how this will pave the way for data centers to pursue higher performance.",Walter Cataldo,cataldo_walter,Mon Nov 25 23:45:08 +0000 2019,0,6,English,"<a href=""http://twitter.com/download/iphone"" rel=""nofollow"">Twitter for iPhone</a>",Retweet,,,0,0,1
1199994929541312512,Be aware of @ASRockUSA #BIOS update! Especially MB for #Ryzen. Very buggy! I have lost my mellanox connectx-3 and now Samsung nvme got error entries increased over time; and recently #BSOD Win and Linux freezes,Saiful Rahman Barito,AmanFatHa,Thu Nov 28 10:14:20 +0000 2019,0,0,English,"<a href=""https://mobile.twitter.com"" rel=""nofollow"">Twitter Web App</a>",Tweet,,,0,3,1
1200376115405213696,"HPC for the Win! @SUSE is the proud recipient of HPCwire’s Readers’ Choice award for Best HPC Collaboration for our collaboration with HPE Marvell, Mellanox and Arm on the UK Catalyst project. https://t.co/mAqKehN7lw",Mario Schuld,IamSchuld,Fri Nov 29 11:29:02 +0000 2019,1,0,English,"<a href=""https://buffer.com"" rel=""nofollow"">Buffer</a>",Tweet,Photo,https://pbs.twimg.com/media/EKiXtyyWsAAACcf.jpg ,0,0,1